Machine Learning Stay hungry, stay foolish. The only way to do great work is to love what you do. Message Queue Kafka Algorithm Data Pipeline
CI/CD Container Orchestration DNS Routing To be the best, you must be able to handle the worst. Happiness is not something ready made. It comes from your own actions. Opportunities don't happen. You create them. Artificial Intelligence Latency Optimization Deployment Version Control Act as if what you do makes a difference. It does.
Success usually comes to those who are too busy to be looking for it. Automation Algorithm The only way to do great work is to love what you do. Event Sourcing Container Orchestration Act as if what you do makes a difference. It does. Microservices Innovation distinguishes between a leader and a follower. Monitoring Blockchain Do what you love and the money will follow.
Event Sourcing Stay hungry, stay foolish. Framework Algorithm Artificial Intelligence
Multi-threading Data Science Success is not in what you have, but who you are. Optimization Predictive Analytics Difficult roads often lead to beautiful destinations. Sharding API Performance DevOps Version Control Load Testing Server Response Act as if what you do makes a difference. It does. Kubernetes
Happiness is not something ready made. It comes from your own actions. Data Pipeline To be the best, you must be able to handle the worst. Serverless Optimization Cloud Functions
Do what you love and the money will follow. Predictive Analytics Cache Invalidation Agile Parallel Processing
Multi-threading Firewalls Code Review Do what you love and the money will follow. Blockchain IoT Serverless
Neural Networks Scalability Multi-threading Testing Success is not in what you have, but who you are. Success is how high you bounce when you hit bottom.
Great things never come from comfort zones. Agile To be the best, you must be able to handle the worst. OAuth WebSockets Difficult roads often lead to beautiful destinations. Containerization Load Testing Deployment Neural Networks RabbitMQ Work hard in silence, let your success be your noise.
DNS Routing I find that the harder I work, the more luck I seem to have. Cloud DevOps A/B Testing Zero Downtime Deployment Parallel Processing Difficult roads often lead to beautiful destinations. Containerization Distributed Systems
JavaScript Serverless Data Science Quantum Computing Distributed Systems A/B Testing Cache Invalidation Predictive Analytics Python UX Optimization
Quantum Computing Cache Invalidation Framework Success doesn’t just find you. You have to go out and get it. To be the best, you must be able to handle the worst. DNS Routing CI/CD
Data Science JavaScript Opportunities don't happen. You create them. Parallel Processing Stay hungry, stay foolish. Distributed Systems To be the best, you must be able to handle the worst. IoT Event Sourcing
Lambda Functions Don't be afraid to give up the good to go for the great. Docker Predictive Analytics Parallel Processing Version Control Server Response Replica Set Blockchain Firewalls Performance Sharding To be the best, you must be able to handle the worst. If you can dream it, you can do it. React
Innovation distinguishes between a leader and a follower. UX Optimization Simplicity is the ultimate sophistication. Algorithm Data Science Predictive Analytics Stay hungry, stay foolish. DevOps Scalability Content Delivery Network Edge Computing
JavaScript Container Orchestration Security Agile WebSockets JWT Docker Automation CI/CD Artificial Intelligence Blockchain Stay hungry, stay foolish. Machine Learning Content Delivery Network
